{
  "schema_version": "2.0",
  "profile_id": "WEB-ANGULAR-SSR-NODE",
  "profile_version": "1.0.0-candidate.1",
  "generated_at": "2026-08-21",
  "validated": false,
  "profile_sha256": "f043d25b8146c6ba0dc8a07a6c6820c7c0115b036c32250a18cde628d242a9df",
  "driver_sha256": "e76ab48efa9ec86b308ac63b79aa6236b0e52eecf2138877c45d26ee3e5b7323",
  "scaffold_sha256": "cd97ded1966e4023c5876bf02298bf718affb6abfb7950a960d8e41248dfe658",
  "capabilities": [
    {
      "id": "CAP-BROWSER-PLAYWRIGHT",
      "version": "1.0.0",
      "digest": "ba3eaff34aa18d8b9d69c35efdd1d70a537d978c75be1ed5a976dc03fb37a881"
    },
    {
      "id": "CAP-DELIVERY-EVIDENCE",
      "version": "1.0.0",
      "digest": "cd3e887e974ac8310d0411ec8aa8410500138692e4497fa87cebb443f073d966"
    },
    {
      "id": "CAP-FRONTEND-QUALITY",
      "version": "1.0.0",
      "digest": "ec287b3f774e7800531e06521ebd038f3c5fe8ac14f25e803d9b312b450e43c8"
    },
    {
      "id": "CAP-SCAFFOLD-COPY",
      "version": "1.0.0",
      "digest": "d80b6618d83caffc7eae3b326c4696363e83d32be6ddc08bf12ed8abd0f6e89d"
    },
    {
      "id": "CAP-SSR-RUNTIME",
      "version": "1.0.0",
      "digest": "669b3264bd64db2aa1a83764010d338aff13bbc7822ff098633545188458417e"
    }
  ],
  "components": [
    {
      "name": "Angular SSR",
      "version": "22.1.x",
      "source": "profile:backend",
      "digest": null
    },
    {
      "name": "Node.js",
      "version": "24.x LTS",
      "source": "profile:backend",
      "digest": null
    },
    {
      "name": "Angular server bundle",
      "version": "candidate contract 1.0",
      "source": "profile:delivery",
      "digest": null
    },
    {
      "name": "Angular",
      "version": "22.1.x",
      "source": "profile:frontend",
      "digest": null
    },
    {
      "name": "TypeScript",
      "version": "6.0.x",
      "source": "profile:frontend",
      "digest": null
    },
    {
      "name": "server and client telemetry",
      "version": "project decision",
      "source": "profile:observability",
      "digest": null
    },
    {
      "name": "Playwright",
      "version": "1.62.x",
      "source": "profile:testing",
      "digest": null
    },
    {
      "name": "Vitest",
      "version": "4.1.x",
      "source": "profile:testing",
      "digest": null
    }
  ],
  "gates": [
    {
      "id": "GATE-BROWSER-ACCESSIBILITY",
      "phase": "G3",
      "required": true,
      "status": "not-run",
      "evidence": "profile WEB-ANGULAR-SSR-NODE: exact certification not available"
    },
    {
      "id": "GATE-BROWSER-SMOKE",
      "phase": "G3",
      "required": true,
      "status": "not-run",
      "evidence": "profile WEB-ANGULAR-SSR-NODE: exact certification not available"
    },
    {
      "id": "GATE-COMPOSE-ANGULAR-SSR",
      "phase": "G3",
      "required": true,
      "status": "not-run",
      "evidence": "profile WEB-ANGULAR-SSR-NODE: exact certification not available"
    },
    {
      "id": "GATE-DELIVERY-EVIDENCE",
      "phase": "G4",
      "required": true,
      "status": "not-run",
      "evidence": "profile WEB-ANGULAR-SSR-NODE: exact certification not available"
    },
    {
      "id": "GATE-FRONTEND-LINT",
      "phase": "G3",
      "required": true,
      "status": "not-run",
      "evidence": "profile WEB-ANGULAR-SSR-NODE: exact certification not available"
    },
    {
      "id": "GATE-FRONTEND-LOCK",
      "phase": "G3",
      "required": true,
      "status": "not-run",
      "evidence": "profile WEB-ANGULAR-SSR-NODE: exact certification not available"
    },
    {
      "id": "GATE-FRONTEND-TEST",
      "phase": "G3",
      "required": true,
      "status": "not-run",
      "evidence": "profile WEB-ANGULAR-SSR-NODE: exact certification not available"
    },
    {
      "id": "GATE-FRONTEND-TYPECHECK",
      "phase": "G3",
      "required": true,
      "status": "not-run",
      "evidence": "profile WEB-ANGULAR-SSR-NODE: exact certification not available"
    },
    {
      "id": "GATE-SCAFFOLD-INTEGRITY",
      "phase": "G2",
      "required": true,
      "status": "not-run",
      "evidence": "profile WEB-ANGULAR-SSR-NODE: exact certification not available"
    },
    {
      "id": "GATE-SSR-BUILD",
      "phase": "G3",
      "required": true,
      "status": "not-run",
      "evidence": "profile WEB-ANGULAR-SSR-NODE: exact certification not available"
    },
    {
      "id": "GATE-SSR-HYDRATION",
      "phase": "G3",
      "required": true,
      "status": "not-run",
      "evidence": "profile WEB-ANGULAR-SSR-NODE: exact certification not available"
    },
    {
      "id": "GATE-SSR-RUNTIME",
      "phase": "G3",
      "required": true,
      "status": "not-run",
      "evidence": "profile WEB-ANGULAR-SSR-NODE: exact certification not available"
    }
  ],
  "composition": {
    "gate_id": "GATE-COMPOSE-ANGULAR-SSR",
    "status": "not-run",
    "digest": "932b1d11b4863f89004f99910c977d25cf82e45666475095696cd40c855e5117"
  },
  "evidence": [
    "Candidate scaffold and gates are packaged; certification is pending."
  ]
}
