{
  "schema_version": "2.0",
  "profile_id": "WEB-REACT-VITE-ENTRA-STATIC",
  "profile_version": "1.0.0-candidate.1",
  "generated_at": "2026-08-21",
  "validated": false,
  "profile_sha256": "547f4fdd8e3d9a108b7d32e2c0568df0df7ca3da49baf05c580ca6d0271e43d4",
  "driver_sha256": "6140977614ea57ea5d393664de2ec482d049c267e02b432be0a05302ec00345a",
  "scaffold_sha256": "9a835ca16abfc3ae409f0ceda06b840850d0c86e92504488195a7d846f6b236a",
  "capabilities": [
    {
      "id": "CAP-BROWSER-PLAYWRIGHT",
      "version": "1.0.0",
      "digest": "ba3eaff34aa18d8b9d69c35efdd1d70a537d978c75be1ed5a976dc03fb37a881"
    },
    {
      "id": "CAP-DELIVERY-EVIDENCE",
      "version": "1.0.0",
      "digest": "cd3e887e974ac8310d0411ec8aa8410500138692e4497fa87cebb443f073d966"
    },
    {
      "id": "CAP-ENTRA-CLAIMS",
      "version": "1.0.0",
      "digest": "b3d238587b329a202e3c24d29a0870e38c332e600a026520408322e2d97e0cf3"
    },
    {
      "id": "CAP-FRONTEND-QUALITY",
      "version": "1.0.0",
      "digest": "ec287b3f774e7800531e06521ebd038f3c5fe8ac14f25e803d9b312b450e43c8"
    },
    {
      "id": "CAP-IDENTITY-OIDC",
      "version": "1.0.0",
      "digest": "96a4f95763e8e8abbeadf30f054f9205e1b4fd480f49a330351fe334d67a2d5a"
    },
    {
      "id": "CAP-OIDC-SPA-PKCE",
      "version": "1.0.0",
      "digest": "82ea787ffda2d2cdf5e1d48270ce2f57791b4329ca4f91fb1a8bc9e5793fa0d8"
    },
    {
      "id": "CAP-SCAFFOLD-COPY",
      "version": "1.0.0",
      "digest": "d80b6618d83caffc7eae3b326c4696363e83d32be6ddc08bf12ed8abd0f6e89d"
    },
    {
      "id": "CAP-STATIC-BUNDLE",
      "version": "1.0.0",
      "digest": "62ba9ee62cef52846899e18670d3b8b40c4589a39d1cecd242e8f720deb8918e"
    }
  ],
  "components": [
    {
      "name": "static hosting",
      "version": "immutable-bundle contract 1.0",
      "source": "profile:delivery",
      "digest": null
    },
    {
      "name": "Node.js",
      "version": "24.x LTS",
      "source": "profile:frontend",
      "digest": null
    },
    {
      "name": "React",
      "version": "19.2.x",
      "source": "profile:frontend",
      "digest": null
    },
    {
      "name": "TypeScript",
      "version": "6.0.x",
      "source": "profile:frontend",
      "digest": null
    },
    {
      "name": "Vite",
      "version": "8.2.x",
      "source": "profile:frontend",
      "digest": null
    },
    {
      "name": "MSAL Browser",
      "version": "5.19.x",
      "source": "profile:identity",
      "digest": null
    },
    {
      "name": "Microsoft Entra ID",
      "version": "v2.0 tenant-specific authority",
      "source": "profile:identity",
      "digest": null
    },
    {
      "name": "protected API",
      "version": "confirmed delegated scope contract",
      "source": "profile:integration",
      "digest": null
    },
    {
      "name": "client auth failures, client errors and delivery monitoring",
      "version": "project decision",
      "source": "profile:observability",
      "digest": null
    },
    {
      "name": "Playwright",
      "version": "1.62.x",
      "source": "profile:testing",
      "digest": null
    },
    {
      "name": "Vitest",
      "version": "4.1.x",
      "source": "profile:testing",
      "digest": null
    },
    {
      "name": "axe-core",
      "version": "4.13.x",
      "source": "profile:testing",
      "digest": null
    }
  ],
  "gates": [
    {
      "id": "GATE-BROWSER-ACCESSIBILITY",
      "phase": "G3",
      "required": true,
      "status": "not-run",
      "evidence": "profile WEB-REACT-VITE-ENTRA-STATIC: exact certification not available"
    },
    {
      "id": "GATE-BROWSER-SMOKE",
      "phase": "G3",
      "required": true,
      "status": "not-run",
      "evidence": "profile WEB-REACT-VITE-ENTRA-STATIC: exact certification not available"
    },
    {
      "id": "GATE-COMPOSE-REACT-ENTRA-STATIC",
      "phase": "G3",
      "required": true,
      "status": "not-run",
      "evidence": "profile WEB-REACT-VITE-ENTRA-STATIC: exact certification not available"
    },
    {
      "id": "GATE-DELIVERY-EVIDENCE",
      "phase": "G4",
      "required": true,
      "status": "not-run",
      "evidence": "profile WEB-REACT-VITE-ENTRA-STATIC: exact certification not available"
    },
    {
      "id": "GATE-ENTRA-PERMISSIONS",
      "phase": "G3",
      "required": true,
      "status": "not-run",
      "evidence": "profile WEB-REACT-VITE-ENTRA-STATIC: exact certification not available"
    },
    {
      "id": "GATE-ENTRA-TENANT",
      "phase": "G3",
      "required": true,
      "status": "not-run",
      "evidence": "profile WEB-REACT-VITE-ENTRA-STATIC: exact certification not available"
    },
    {
      "id": "GATE-FRONTEND-BUILD",
      "phase": "G3",
      "required": true,
      "status": "not-run",
      "evidence": "profile WEB-REACT-VITE-ENTRA-STATIC: exact certification not available"
    },
    {
      "id": "GATE-FRONTEND-LINT",
      "phase": "G3",
      "required": true,
      "status": "not-run",
      "evidence": "profile WEB-REACT-VITE-ENTRA-STATIC: exact certification not available"
    },
    {
      "id": "GATE-FRONTEND-LOCK",
      "phase": "G3",
      "required": true,
      "status": "not-run",
      "evidence": "profile WEB-REACT-VITE-ENTRA-STATIC: exact certification not available"
    },
    {
      "id": "GATE-FRONTEND-TEST",
      "phase": "G3",
      "required": true,
      "status": "not-run",
      "evidence": "profile WEB-REACT-VITE-ENTRA-STATIC: exact certification not available"
    },
    {
      "id": "GATE-FRONTEND-TYPECHECK",
      "phase": "G3",
      "required": true,
      "status": "not-run",
      "evidence": "profile WEB-REACT-VITE-ENTRA-STATIC: exact certification not available"
    },
    {
      "id": "GATE-OIDC-CONTRACT",
      "phase": "G3",
      "required": true,
      "status": "not-run",
      "evidence": "profile WEB-REACT-VITE-ENTRA-STATIC: exact certification not available"
    },
    {
      "id": "GATE-OIDC-INTEGRATION",
      "phase": "G3",
      "required": true,
      "status": "not-run",
      "evidence": "profile WEB-REACT-VITE-ENTRA-STATIC: exact certification not available"
    },
    {
      "id": "GATE-OIDC-SPA-PKCE",
      "phase": "G3",
      "required": true,
      "status": "not-run",
      "evidence": "profile WEB-REACT-VITE-ENTRA-STATIC: exact certification not available"
    },
    {
      "id": "GATE-OIDC-SPA-SESSION",
      "phase": "G3",
      "required": true,
      "status": "not-run",
      "evidence": "profile WEB-REACT-VITE-ENTRA-STATIC: exact certification not available"
    },
    {
      "id": "GATE-SCAFFOLD-INTEGRITY",
      "phase": "G2",
      "required": true,
      "status": "not-run",
      "evidence": "profile WEB-REACT-VITE-ENTRA-STATIC: exact certification not available"
    },
    {
      "id": "GATE-STATIC-OUTPUT",
      "phase": "G3",
      "required": true,
      "status": "not-run",
      "evidence": "profile WEB-REACT-VITE-ENTRA-STATIC: exact certification not available"
    }
  ],
  "composition": {
    "gate_id": "GATE-COMPOSE-REACT-ENTRA-STATIC",
    "status": "not-run",
    "digest": "2054d453d9a1d3423bac181c37eade528eef00d3f2b91f908307613c6740feca"
  },
  "evidence": [
    "Candidate scaffold, local auth-contract gates and an opt-in real-browser interoperability gate are packaged; exact certification is pending."
  ]
}
