{
  "schema_version": "2.0",
  "profile_id": "API-FASTAPI-KEYCLOAK-PG-OCI",
  "profile_version": "1.1.0",
  "generated_at": "2026-08-31",
  "validated": true,
  "profile_sha256": "715370fd509e5d79c8bb0c625cd8630e3a222660ea37b5948a8cb574b00cce82",
  "driver_sha256": "9e01ccb460da5daa9ac94b4a8997332682f7b6f8bca96427224c0ca03b1f4ee1",
  "scaffold_sha256": "e74a791dd51b4efd68888c6137a51cc9ed6196dc80353b784874b7392263f5c7",
  "capabilities": [
    {
      "id": "CAP-API-CONTRACT",
      "version": "1.0.0",
      "digest": "78812070c06bd8ce66dfb07f326b338e4a93b4394628c2fd94cd83c3275c3260"
    },
    {
      "id": "CAP-DATA-POSTGRES",
      "version": "1.0.0",
      "digest": "7b764c2e269cce1915189e215adf1bf9893e6d57d749a45e7c4863c7752cdffe"
    },
    {
      "id": "CAP-DELIVERY-EVIDENCE",
      "version": "1.0.0",
      "digest": "cd3e887e974ac8310d0411ec8aa8410500138692e4497fa87cebb443f073d966"
    },
    {
      "id": "CAP-IDENTITY-OIDC",
      "version": "1.0.0",
      "digest": "96a4f95763e8e8abbeadf30f054f9205e1b4fd480f49a330351fe334d67a2d5a"
    },
    {
      "id": "CAP-OCI-RUNTIME",
      "version": "1.0.0",
      "digest": "be051ab5ffb29c826e637ad0e0da17529d22a8add1f2876740640dac54a515a8"
    },
    {
      "id": "CAP-SCAFFOLD-COPY",
      "version": "1.0.0",
      "digest": "d80b6618d83caffc7eae3b326c4696363e83d32be6ddc08bf12ed8abd0f6e89d"
    }
  ],
  "components": [
    {
      "name": "Alembic",
      "version": "1.19.x",
      "source": "profile:backend",
      "digest": null
    },
    {
      "name": "FastAPI",
      "version": "0.141.x",
      "source": "profile:backend",
      "digest": null
    },
    {
      "name": "Python",
      "version": "3.14.x",
      "source": "profile:backend",
      "digest": null
    },
    {
      "name": "SQLAlchemy",
      "version": "2.0.x",
      "source": "profile:backend",
      "digest": null
    },
    {
      "name": "PostgreSQL",
      "version": "18.x",
      "source": "profile:data",
      "digest": null
    },
    {
      "name": "OCI image",
      "version": "digest-pinned base",
      "source": "profile:delivery",
      "digest": null
    },
    {
      "name": "Keycloak OIDC",
      "version": "26.7.x",
      "source": "profile:identity",
      "digest": null
    },
    {
      "name": "OpenAPI",
      "version": "3.1.x",
      "source": "profile:integration",
      "digest": null
    },
    {
      "name": "health, readiness and structured logs",
      "version": "profile contract 1.0",
      "source": "profile:observability",
      "digest": null
    },
    {
      "name": "pytest",
      "version": "9.1.x",
      "source": "profile:testing",
      "digest": null
    }
  ],
  "gates": [
    {
      "id": "GATE-API-LINT",
      "phase": "G3",
      "required": true,
      "status": "passed",
      "evidence": "profiles/API-FASTAPI-KEYCLOAK-PG-OCI/certification-evidence.json"
    },
    {
      "id": "GATE-API-LOCK",
      "phase": "G3",
      "required": true,
      "status": "passed",
      "evidence": "profiles/API-FASTAPI-KEYCLOAK-PG-OCI/certification-evidence.json"
    },
    {
      "id": "GATE-API-OPENAPI",
      "phase": "G3",
      "required": true,
      "status": "passed",
      "evidence": "profiles/API-FASTAPI-KEYCLOAK-PG-OCI/certification-evidence.json"
    },
    {
      "id": "GATE-API-TEST",
      "phase": "G3",
      "required": true,
      "status": "passed",
      "evidence": "profiles/API-FASTAPI-KEYCLOAK-PG-OCI/certification-evidence.json"
    },
    {
      "id": "GATE-API-TYPECHECK",
      "phase": "G3",
      "required": true,
      "status": "passed",
      "evidence": "profiles/API-FASTAPI-KEYCLOAK-PG-OCI/certification-evidence.json"
    },
    {
      "id": "GATE-COMPOSE-FASTAPI-OIDC-PG",
      "phase": "G3",
      "required": true,
      "status": "passed",
      "evidence": "profiles/API-FASTAPI-KEYCLOAK-PG-OCI/certification-evidence.json"
    },
    {
      "id": "GATE-DATA-INTEGRATION",
      "phase": "G3",
      "required": true,
      "status": "passed",
      "evidence": "profiles/API-FASTAPI-KEYCLOAK-PG-OCI/certification-evidence.json"
    },
    {
      "id": "GATE-DATA-MIGRATION",
      "phase": "G3",
      "required": true,
      "status": "passed",
      "evidence": "profiles/API-FASTAPI-KEYCLOAK-PG-OCI/certification-evidence.json"
    },
    {
      "id": "GATE-DELIVERY-EVIDENCE",
      "phase": "G4",
      "required": true,
      "status": "passed",
      "evidence": "profiles/API-FASTAPI-KEYCLOAK-PG-OCI/certification-evidence.json"
    },
    {
      "id": "GATE-OCI-BUILD",
      "phase": "G3",
      "required": true,
      "status": "passed",
      "evidence": "profiles/API-FASTAPI-KEYCLOAK-PG-OCI/certification-evidence.json"
    },
    {
      "id": "GATE-OCI-SMOKE",
      "phase": "G3",
      "required": true,
      "status": "passed",
      "evidence": "profiles/API-FASTAPI-KEYCLOAK-PG-OCI/certification-evidence.json"
    },
    {
      "id": "GATE-OIDC-CONTRACT",
      "phase": "G3",
      "required": true,
      "status": "passed",
      "evidence": "profiles/API-FASTAPI-KEYCLOAK-PG-OCI/certification-evidence.json"
    },
    {
      "id": "GATE-OIDC-INTEGRATION",
      "phase": "G3",
      "required": true,
      "status": "passed",
      "evidence": "profiles/API-FASTAPI-KEYCLOAK-PG-OCI/certification-evidence.json"
    },
    {
      "id": "GATE-SCAFFOLD-INTEGRITY",
      "phase": "G2",
      "required": true,
      "status": "passed",
      "evidence": "profiles/API-FASTAPI-KEYCLOAK-PG-OCI/certification-evidence.json"
    }
  ],
  "composition": {
    "gate_id": "GATE-COMPOSE-FASTAPI-OIDC-PG",
    "status": "passed",
    "digest": "eb6a3c7ca5775f585e7483433e37c80c70d8e8ee9ad9cf1d40f941d89fc95e04"
  },
  "evidence": [
    "python scripts/validate_reference_profile.py --profile API-FASTAPI-KEYCLOAK-PG-OCI",
    "python scripts/run_reference_profile_gate.py --profile API-FASTAPI-KEYCLOAK-PG-OCI --runtime docker --containers",
    "tests/test_multi_profile_delivery.py"
  ]
}
